[
  {
    "id": "svc_microneedling_prp",
    "slug": "microneedling-skin-renewal-prp",
    "nameKey": "svc.microneedling_prp.name",
    "descriptionKey": "svc.microneedling_prp.desc",
    "detailsKey": "svc.microneedling_prp.details",
    "isPromoActive": true,
    "categoryId": "cat_microneedling_mesotherapy",
    "isPopular": false,
    "images": {
      "primary": "/microneedling.jpg",
      "secondary": "/microneedling2.jpg"
    },
    "notesKeys": [
      "note.microneedling.sessions",
      "note.microneedling.safe",
      "note.microneedling.downtime"
    ],
    "goalsKeys": [
      "goal.microneedling.texture",
      "goal.microneedling.scars",
      "goal.microneedling.pores"
    ],
    "treatableAreaKeys": [
      "area.microneedling.full_face",
      "area.microneedling.neck",
      "area.microneedling.decollete",
      "area.microneedling.hands",
      "area.microneedling.other"
    ]
  },
  {
    "id": "svc_microneedling_polynucleotides",
    "slug": "microneedling-skin-renewal-polynucleotides",
    "nameKey": "svc.microneedling_pn.name",
    "descriptionKey": "svc.microneedling_pn.desc",
    "detailsKey": "svc.microneedling_pn.details",
    "isPromoActive": true,
    "categoryId": "cat_microneedling_mesotherapy",
    "isPopular": false,
    "images": {
      "primary": "/pn.jpg",
      "secondary": "/pn2.jpg"
    },
    "notesKeys": [
      "note.microneedling.sessions",
      "note.microneedling.safe",
      "note.microneedling.downtime"
    ],
    "goalsKeys": [
      "goal.microneedling.texture",
      "goal.microneedling.scars",
      "goal.microneedling.pores"
    ],
    "treatableAreaKeys": [
      "area.microneedling.full_face",
      "area.microneedling.neck",
      "area.microneedling.decollete",
      "area.microneedling.hands",
      "area.microneedling.other"
    ]
  },
  {
    "id": "svc_microneedling_pdrn",
    "slug": "microneedling-skin-renewal-pdrn",
    "nameKey": "svc.microneedling_pdrn.name",
    "descriptionKey": "svc.microneedling_pdrn.desc",
    "detailsKey": "svc.microneedling_pdrn.details",
    "isPromoActive": true,
    "categoryId": "cat_microneedling_mesotherapy",
    "isPopular": false,
    "images": {
      "primary": "/pdrn.jpg",
      "secondary": "/pdrn2.jpg"
    },
    "notesKeys": [
      "note.microneedling.sessions",
      "note.microneedling.safe",
      "note.microneedling.downtime",
      "note.microneedling.pdrn_formula",
      "note.microneedling.pdrn_timeline"
    ],
    "goalsKeys": [
      "goal.microneedling.texture",
      "goal.microneedling.scars",
      "goal.microneedling.pores"
    ],
    "treatableAreaKeys": [
      "area.microneedling.full_face",
      "area.microneedling.neck",
      "area.microneedling.decollete",
      "area.microneedling.hands",
      "area.microneedling.other"
    ]
  },
  {
    "id": "svc_microneedling_toskani",
    "slug": "microneedling-skin-renewal-toskani",
    "nameKey": "svc.microneedling_toskani.name",
    "descriptionKey": "svc.microneedling_toskani.desc",
    "detailsKey": "svc.microneedling_toskani.details",
    "isPromoActive": false,
    "categoryId": "cat_microneedling_mesotherapy",
    "isPopular": false,
    "images": {
      "primary": "/toskani.jpg",
      "secondary": "/toskani2.jpg"
    },
    "notesKeys": [
      "note.microneedling.sessions",
      "note.microneedling.safe",
      "note.microneedling.downtime"
    ],
    "goalsKeys": [
      "goal.microneedling.texture",
      "goal.microneedling.scars",
      "goal.microneedling.pores"
    ],
    "treatableAreaKeys": [
      "area.microneedling.full_face",
      "area.microneedling.neck",
      "area.microneedling.decollete",
      "area.microneedling.hands",
      "area.microneedling.other"
    ]
  },
  {
    "id": "svc_mesotherapy_infusions",
    "slug": "mesotherapy-infusions",
    "categoryId": "cat_microneedling_mesotherapy",
    "nameKey": "svc.mesotherapy.name",
    "descriptionKey": "svc.mesotherapy.desc",
    "detailsKey": "svc.mesotherapy.details",
    "isPopular": true,
    "isPromoActive": true,
    "images": {
      "primary": "/mesotherapy.jpg",
      "secondary": "/mesotherapy2.jpg"
    },
    "notesKeys": [
      "note.mesotherapy.customized",
      "note.mesotherapy.sessions",
      "note.mesotherapy.downtime"
    ],
    "goalsKeys": [
      "goal.mesotherapy.hydrate",
      "goal.mesotherapy.collagen",
      "goal.mesotherapy.texture"
    ],
    "treatableAreaKeys": [
      "area.mesotherapy.full_face",
      "area.mesotherapy.neck",
      "area.mesotherapy.decollete",
      "area.mesotherapy.hands",
      "area.mesotherapy.cheeks",
      "area.mesotherapy.under_eyes",
      "area.mesotherapy.scalp",
      "area.mesotherapy.stretch_marks",
      "area.mesotherapy.other"
    ],
    "filterConfig": {
      "defaultKey": "all",
      "viewAllLabelKey": "filter.view_all",
      "filters": [
        {
          "key": "prp",
          "labelKey": "filter.mesotherapy.prp"
        },
        {
          "key": "pn",
          "labelKey": "filter.mesotherapy.pn"
        },
        {
          "key": "pdrn",
          "labelKey": "filter.mesotherapy.pdrn"
        },
        {
          "key": "ha",
          "labelKey": "filter.mesotherapy.ha"
        }
      ]
    }
  }
]
